brand,product_name,description,category1,category2,image_url,processed_image_path
Tsujiri,Matcha Milk - Uji Matcha Double Rich,"Tsujiri's Matcha Milk - Uji Matcha Double Rich is a decadent and creamy beverage that combines the vibrant flavors of Uji Matcha with rich, creamy milk. Made with only the highest quality ingredients, this drink offers a double dose of matcha goodness for a truly indulgent experience. Perfect for matcha lovers looking for a luxurious and satisfying treat, Tsujiri's Matcha Milk - Uji Matcha Double Rich is a must-try for those seeking a premium match",Beverages,Coffee & Tea,https://www.takaski.com/wp-content/uploads/2018/09/KATAOKA-Tsujiri-Matcha-Milk-Koicha-Double-Rich-Taste-Made-in-Japan.jpg,processed_images/Tsujiri_Matcha_Milk_-_Uji_Matcha_Double_Rich.png
斗利,Matcha Milk Uji Matcha Double Rich,"Experience the perfect blend of traditional Japanese matcha and creamy milk with 斗利's Matcha Milk Uji Matcha Double Rich. Sourced from the famed Uji region of Japan, this double-rich matcha milk offers a bold and authentic matcha flavor with a smooth, indulgent texture. Ideal for both hot and cold beverages, this premium product is perfect for matcha enthusiasts looking for a convenient and delicious way to enjoy their favorite green tea.",Beverages,Coffee & Tea,https://img06.weeecdn.com/item/image/088/310/767A9E1361672124.jpeg!c750x0.jpeg,processed_images/斗利_Matcha_Milk_Uji_Matcha_Double_Rich.png
Magija,Quark bar with lemon,"Introducing the Quark bar with lemon from Magija, a refreshing and tangy treat perfect for satisfying your sweet tooth. Made with creamy quark cheese blended with zesty lemon flavor, this unique and indulgent snack is a delightful combination of tart and creamy. Packed with protein and low in sugar, it's a guilt-free option for a light and flavorful snack on the go. Treat yourself to the deliciousness of Magija's Quark bar with lemon today!",Confectionery & Sweets,Baked Sweets,https://lituanicawholesale.com/image/cache/catalog/Products%20Images/2022/August/67922-600x600.png,processed_images/Magija_Quark_bar_with_lemon.png
Marge,Milk 2.0%,"Introducing Milk 2.0%, a nutritious and versatile dairy product perfect for all your cooking and drinking needs. This 2.0% fat content milk strikes the perfect balance between richness and lightness, offering a creamy texture with a slightly lower fat content than whole milk. Packed with essential vitamins and minerals, Milk 2.0% is a great source of calcium and protein to support your overall health and well-being. Whether you're enjoying a glass on its own, adding it to",Dairy & Eggs,Milk & Cream,https://kontorikaubad.ee/sites/default/files/styles/large/public/product-images/piim_marge_20_uht_1l_5.jpg?itok=55q1aVAJ,processed_images/Marge_Milk_2.0%.png
Snickers,Snickers Bar,"Snickers Bar is a classic chocolate bar made with layers of nougat, caramel, roasted peanuts, and milk chocolate. Known for its satisfying combination of sweet and salty flavors, this iconic treat is perfect for curbing hunger cravings and indulging in a delicious snack. Whether you're on the go or need a pick-me-up, Snickers Bar is the perfect choice for a tasty and satisfying treat.",Confectionery & Sweets,Chocolate,https://jackscandy.com/cdn/shop/products/535600-01.jpg?v=1666934326&width=1200,processed_images/Snickers_Snickers_Bar.png
Mars,Bounty,"Introducing Bounty – a cutting-edge Mars exploration tool designed to maximize efficiency and productivity on the red planet. This versatile product combines advanced technology and durable materials to withstand the harsh Martian environment, making it ideal for research missions, resource extraction, and sample collection. With its innovative design and user-friendly interface, Bounty is the go-to tool for scientists, engineers, and astronauts looking to uncover the mysteries of Mars. Explore more with Bounty – your key to unlocking the secrets of the universe.",Dry Goods & Pantry,Not Applicable,https://c8.alamy.com/comp/2H5G609/mars-bounty-snickers-milky-way-and-twix-chocolate-bars-brands-of-mars-incorporated-2H5G609.jpg,processed_images/Mars_Bounty.png
Mars,Bounty,"Bounty is a high-performance Mars rover designed to explore the surface of the red planet, equipped with cutting-edge technology for conducting scientific research and collecting valuable data. This advanced robotic vehicle is built to withstand the extreme conditions of Mars, with a durable design that allows it to traverse rough terrain and gather samples with precision. Bounty's state-of-the-art instruments and sensors enable it to analyze the Martian environment, helping to unlock the mysteries of the planet and further our understanding of the potential for life beyond Earth.",Confectionery & Sweets,Chocolate,https://i.ebayimg.com/images/g/IVMAAOSwcFRfc0C6/s-l1200.jpg,processed_images/Mars_Bounty.png
Pieno Žvaigždės,Mu Pienas 3.5%,"Mu Pienas 3.5% by Pieno Žvaigždės is a high-quality dairy product made with 100% natural cow's milk containing 3.5% fat. This delicious milk is rich in calcium, protein, and essential vitamins, perfect for adding creaminess to your coffee, cereal, or baking recipes. Enjoy the wholesome goodness of Mu Pienas 3.5% as a nutritious and flavorful addition to your daily routine.",Dairy & Eggs,Milk & Cream,https://rodyna.co.uk/cdn/shop/files/Milk3.5_FatMu1L.png?v=1715021979,processed_images/Pieno Žvaigždės_Mu_Pienas_3.5%.png
